pathway,pathway_genes,complex,pathway_pval_FISH,pathway_pval_BIN,pathway_n,pathway_pct,top_level_pathway,top_level_pathway_genes,top_level_pathway_pval_FISH,top_level_pathway_pval_BIN,top_level_pathway_n,top_level_pathway_pct,top_level_pathway_adj_pval_BIN-BF,top_level_pathway_adj_pval_FISH-BF,top_level_pathway_adj_pval_BIN-BH,top_level_pathway_adj_pval_FISH-BH,pathway_adj_pval_BIN-BF,pathway_adj_pval_FISH-BF,pathway_adj_pval_BIN-BH,pathway_adj_pval_FISH-BH,cell,source
Resistance of ERBB2 KD mutants to tesevatinib,['HSP90AA1'],"['ERBB2 ECD mutants:ERBIN:HSP90:CDC37 [plasma membrane]', 'ERBB2 KD mutants (neratinib resistant):ERBIN:HSP90:CDC37 [plasma membrane]', 'CDC37 [cytosol]', 'Phospho-EGFRvIIImut:HSP90:CDC37 [plasma membrane]', 'p-5Y-EGFRvIII:p-Y349,Y350-SHC1:GRB2:SOS1 [plasma membrane]', 'ERBB2 KD mutants (TKI sensitive):ERBIN:HSP90:CDC37 [plasma membrane]', 'ERBB2 TMD/JMD mutants (TKI sensitive):TKI:ERBIN:HSP90:CDC37 [plasma membrane]', 'ERBB2 R678Q:pertuzumab:ERBIN:HSP90:CDC37 [plasma membrane]', 'EGF:Ligand-responsive EGFR mutants resistant to non-covalent TKIs:HSP90:CDC37 [plasma membrane]', 'ERBB2 ECD mutants:ERBIN:HSP90:CDC37:trastuzumab [plasma membrane]', 'ERBB2 TMD/JMD mutants (pertuzumab resistant):ERBIN:HSP90:CDC37 [plasma membrane]', 'RIPK3:HSP90:CDC37 [cytosol]', 'EGFRvIII mutant dimer [plasma membrane]', 'EGF:Ligand-responsive EGFR mutants sensitive to non-covalent TKIs:HSP90:CDC37 [plasma membrane]', 'VCP:PolyUb-Misfolded Proteins:HDAC6:HSP90:HSF1 [cytosol]', 'ERBB2 T733I:ERBIN:HSP90:CDC37 [plasma membrane]', 'ERBB2 KD mutants (AEE788 resistant):ERBIN:HSP90:CDC37 [plasma membrane]', 'MLKL:HSP90:CDC37 [cytosol]', 'EGF:Ligand-responsive p-6Y-EGFR mutants sensitive to non-covalent TKIs:HSP90:CDC37 [plasma membrane]', 'ERBB2 KD mutants (trastuzumab sensitive):ERBIN:HSP90:CDC37 [plasma membrane]', 'HSP90:HSF1 [cytosol]', 'ERBB2 TMD/JMD mutants (trastuzumab):ERBIN:HSP90:CDC37 [plasma membrane]', 'ERBB2 R678Q:ERBIN:HSP90:CDC37 [plasma membrane]', 'p-5Y-EGFRvIII:PLCG1 [plasma membrane]', 'p-5Y-EGFRvIII:p-Y771,Y783,Y1254-PLCG1 [plasma membrane]', 'ERBB2 KD mutants (osimertinib resistant):ERBIN:HSP90:CDC37 [plasma membrane]', 'p-5Y-EGFRvIII:p-Y349,Y350-SHC1 [plasma membrane]', 'Ligand-responsive EGFR mutants resistant to non-covalent TKIs:HSP90:CDC37 [plasma membrane]', 'ERBB2 ECD mutants:ERBIN:HSP90:CDC37:TKIs [plasma membrane]', 'Ub-ERBB2:ERBIN:HSP90:CDC37 [plasma membrane]', 'Ligand-responsive p-6Y-EGFR mutants resistant to non-covalent TKIs:HSP90:CDC37 [plasma membrane]', 'Ligand-responsive EGFR mutants sensitive to non-covalent TKIs:HSP90:CDC37 [plasma membrane]', 'VCP:HDAC6:HSP90:HSF1 [cytosol]', 'Ub-ERBB2:ERBIN:Ub-HSP90:CDC37 [plasma membrane]', 'Dimers of EGF:Ligand-responsive EGFR mutants resistant to non-covalent TKIs [plasma membrane]', 'p-5Y-EGFRvIII:SHC1 [plasma membrane]', 'ERBB2:trastuzumab:ERBIN:HSP90:CDC37 [plasma membrane]', 'Dimers of EGF:Ligand-responsive EGFR mutants sensitive to non-covalent TKIs [plasma membrane]', 'Dimers of ligand-responsive EGFR mutants sensitive to non-covalent TKIs  [plasma membrane]', 'ERBB2 KD mutants (trastuzumab sensitive):trastuzumab:ERBIN:HSP90:CDC37 [plasma membrane]', 'ERBB2 TMD/JMD mutants:ERBIN:HSP90:CDC37 [plasma membrane]', 'ERBB2:ERBIN:HSP90:CDC37 [plasma membrane]', 'p-5Y-EGFRvIII:GRB2:GAB1:PI3K [plasma membrane]', 'ERBB2:pertuzumab:ERBIN:HSP90:CDC37 [plasma membrane]', 'ERBB2 T862A:ERBIN:HSP90:CDC37 [plasma membrane]', 'ERBB2 KD mutants:TKIs:ERBIN:HSP90:CDC37 [plasma membrane]', 'EGF:Ligand-responsive p-6Y-EGFR mutants resistant to non-covalent TKIs:HSP90:CDC37 [plasma membrane]', 'p-5Y-EGFRvIII mutant dimer [plasma membrane]', 'ERBB2 T798M:ERBIN:HSP90:CDC37 [plasma membrane]', 'HSP90 [cytosol]', 'Dimers of ligand-responsive EGFR mutants resistant to non-covalent TKIs [plasma membrane]', 'ERBB2:TKIs:ERBIN:HSP90:CDC37 [plasma membrane]', 'ERBB2 TMD/JMD mutants (TKI sensitive):ERBIN:HSP90:CDC37 [plasma membrane]', 'ERBB2 KD mutants (trastuzumab resistant):ERBIN:HSP90:CDC37 [plasma membrane]', 'Ligand-responsive p-6Y-EGFR mutants sensitive to non-covalent TKIs:HSP90:CDC37 [plasma membrane]', 'HSP90:Benzoquinoid ansamycins [cytosol]', 'ERBB2 TMD/JMD mutants (trastuzumab):trastuzumab:ERBIN:HSP90:CDC37 [plasma membrane]', 'EGFRvIII mutant:HSP90:CDC37 [plasma membrane]', 'ERBB2 KD mutants:ERBIN:HSP90:CDC37 [plasma membrane]', 'p-5Y-EGFRvIII:GRB2:GAB1 [plasma membrane]', 'p-5Y-EGFRvIII:GRB2:SOS1 [plasma membrane]', 'ERBB2 KD mutants (lapatinib resistant):ERBIN:HSP90:CDC37 [plasma membrane]']",0.0030599071261598137,0.0030587624701018685,1,0.021739130434782608,Disease,"['RNGTT', 'HSP90AA1', 'HMGB1']",0.17371599581369093,0.17377206265847317,3,0.06521739130434782,1.0,1.0,0.20546633823769156,0.2054000453646157,0.5750473443791513,0.575262539718045,0.038336489625276755,0.038350835981203,STRIATUM_1 # s1,REACTOME
Resistance of ERBB2 KD mutants to osimertinib,['HSP90AA1'],"['ERBB2 ECD mutants:ERBIN:HSP90:CDC37 [plasma membrane]', 'ERBB2 KD mutants (neratinib resistant):ERBIN:HSP90:CDC37 [plasma membrane]', 'CDC37 [cytosol]', 'Phospho-EGFRvIIImut:HSP90:CDC37 [plasma membrane]', 'p-5Y-EGFRvIII:p-Y349,Y350-SHC1:GRB2:SOS1 [plasma membrane]', 'ERBB2 KD mutants (TKI sensitive):ERBIN:HSP90:CDC37 [plasma membrane]', 'ERBB2 TMD/JMD mutants (TKI sensitive):TKI:ERBIN:HSP90:CDC37 [plasma membrane]', 'ERBB2 R678Q:pertuzumab:ERBIN:HSP90:CDC37 [plasma membrane]', 'EGF:Ligand-responsive EGFR mutants resistant to non-covalent TKIs:HSP90:CDC37 [plasma membrane]', 'ERBB2 ECD mutants:ERBIN:HSP90:CDC37:trastuzumab [plasma membrane]', 'ERBB2 TMD/JMD mutants (pertuzumab resistant):ERBIN:HSP90:CDC37 [plasma membrane]', 'RIPK3:HSP90:CDC37 [cytosol]', 'EGFRvIII mutant dimer [plasma membrane]', 'EGF:Ligand-responsive EGFR mutants sensitive to non-covalent TKIs:HSP90:CDC37 [plasma membrane]', 'VCP:PolyUb-Misfolded Proteins:HDAC6:HSP90:HSF1 [cytosol]', 'ERBB2 T733I:ERBIN:HSP90:CDC37 [plasma membrane]', 'ERBB2 KD mutants (AEE788 resistant):ERBIN:HSP90:CDC37 [plasma membrane]', 'MLKL:HSP90:CDC37 [cytosol]', 'EGF:Ligand-responsive p-6Y-EGFR mutants sensitive to non-covalent TKIs:HSP90:CDC37 [plasma membrane]', 'ERBB2 KD mutants (trastuzumab sensitive):ERBIN:HSP90:CDC37 [plasma membrane]', 'HSP90:HSF1 [cytosol]', 'ERBB2 TMD/JMD mutants (trastuzumab):ERBIN:HSP90:CDC37 [plasma membrane]', 'ERBB2 R678Q:ERBIN:HSP90:CDC37 [plasma membrane]', 'p-5Y-EGFRvIII:PLCG1 [plasma membrane]', 'p-5Y-EGFRvIII:p-Y771,Y783,Y1254-PLCG1 [plasma membrane]', 'ERBB2 KD mutants (osimertinib resistant):ERBIN:HSP90:CDC37 [plasma membrane]', 'p-5Y-EGFRvIII:p-Y349,Y350-SHC1 [plasma membrane]', 'Ligand-responsive EGFR mutants resistant to non-covalent TKIs:HSP90:CDC37 [plasma membrane]', 'ERBB2 ECD mutants:ERBIN:HSP90:CDC37:TKIs [plasma membrane]', 'Ub-ERBB2:ERBIN:HSP90:CDC37 [plasma membrane]', 'Ligand-responsive p-6Y-EGFR mutants resistant to non-covalent TKIs:HSP90:CDC37 [plasma membrane]', 'Ligand-responsive EGFR mutants sensitive to non-covalent TKIs:HSP90:CDC37 [plasma membrane]', 'VCP:HDAC6:HSP90:HSF1 [cytosol]', 'Ub-ERBB2:ERBIN:Ub-HSP90:CDC37 [plasma membrane]', 'Dimers of EGF:Ligand-responsive EGFR mutants resistant to non-covalent TKIs [plasma membrane]', 'p-5Y-EGFRvIII:SHC1 [plasma membrane]', 'ERBB2:trastuzumab:ERBIN:HSP90:CDC37 [plasma membrane]', 'Dimers of EGF:Ligand-responsive EGFR mutants sensitive to non-covalent TKIs [plasma membrane]', 'Dimers of ligand-responsive EGFR mutants sensitive to non-covalent TKIs  [plasma membrane]', 'ERBB2 KD mutants (trastuzumab sensitive):trastuzumab:ERBIN:HSP90:CDC37 [plasma membrane]', 'ERBB2 TMD/JMD mutants:ERBIN:HSP90:CDC37 [plasma membrane]', 'ERBB2:ERBIN:HSP90:CDC37 [plasma membrane]', 'p-5Y-EGFRvIII:GRB2:GAB1:PI3K [plasma membrane]', 'ERBB2:pertuzumab:ERBIN:HSP90:CDC37 [plasma membrane]', 'ERBB2 T862A:ERBIN:HSP90:CDC37 [plasma membrane]', 'ERBB2 KD mutants:TKIs:ERBIN:HSP90:CDC37 [plasma membrane]', 'EGF:Ligand-responsive p-6Y-EGFR mutants resistant to non-covalent TKIs:HSP90:CDC37 [plasma membrane]', 'p-5Y-EGFRvIII mutant dimer [plasma membrane]', 'ERBB2 T798M:ERBIN:HSP90:CDC37 [plasma membrane]', 'HSP90 [cytosol]', 'Dimers of ligand-responsive EGFR mutants resistant to non-covalent TKIs [plasma membrane]', 'ERBB2:TKIs:ERBIN:HSP90:CDC37 [plasma membrane]', 'ERBB2 TMD/JMD mutants (TKI sensitive):ERBIN:HSP90:CDC37 [plasma membrane]', 'ERBB2 KD mutants (trastuzumab resistant):ERBIN:HSP90:CDC37 [plasma membrane]', 'Ligand-responsive p-6Y-EGFR mutants sensitive to non-covalent TKIs:HSP90:CDC37 [plasma membrane]', 'HSP90:Benzoquinoid ansamycins [cytosol]', 'ERBB2 TMD/JMD mutants (trastuzumab):trastuzumab:ERBIN:HSP90:CDC37 [plasma membrane]', 'EGFRvIII mutant:HSP90:CDC37 [plasma membrane]', 'ERBB2 KD mutants:ERBIN:HSP90:CDC37 [plasma membrane]', 'p-5Y-EGFRvIII:GRB2:GAB1 [plasma membrane]', 'p-5Y-EGFRvIII:GRB2:SOS1 [plasma membrane]', 'ERBB2 KD mutants (lapatinib resistant):ERBIN:HSP90:CDC37 [plasma membrane]']",0.0030599071261598137,0.0030587624701018685,1,0.021739130434782608,Disease,"['RNGTT', 'HSP90AA1', 'HMGB1']",0.17371599581369093,0.17377206265847317,3,0.06521739130434782,1.0,1.0,0.18668084445595975,0.18662061264556512,0.5750473443791513,0.575262539718045,0.04107481031279652,0.041090181408431785,STRIATUM_1 # s1,REACTOME
Resistance of ERBB2 KD mutants to AEE788,['HSP90AA1'],"['ERBB2 ECD mutants:ERBIN:HSP90:CDC37 [plasma membrane]', 'ERBB2 KD mutants (neratinib resistant):ERBIN:HSP90:CDC37 [plasma membrane]', 'CDC37 [cytosol]', 'Phospho-EGFRvIIImut:HSP90:CDC37 [plasma membrane]', 'p-5Y-EGFRvIII:p-Y349,Y350-SHC1:GRB2:SOS1 [plasma membrane]', 'ERBB2 KD mutants (TKI sensitive):ERBIN:HSP90:CDC37 [plasma membrane]', 'ERBB2 TMD/JMD mutants (TKI sensitive):TKI:ERBIN:HSP90:CDC37 [plasma membrane]', 'ERBB2 R678Q:pertuzumab:ERBIN:HSP90:CDC37 [plasma membrane]', 'EGF:Ligand-responsive EGFR mutants resistant to non-covalent TKIs:HSP90:CDC37 [plasma membrane]', 'ERBB2 ECD mutants:ERBIN:HSP90:CDC37:trastuzumab [plasma membrane]', 'ERBB2 TMD/JMD mutants (pertuzumab resistant):ERBIN:HSP90:CDC37 [plasma membrane]', 'RIPK3:HSP90:CDC37 [cytosol]', 'EGFRvIII mutant dimer [plasma membrane]', 'EGF:Ligand-responsive EGFR mutants sensitive to non-covalent TKIs:HSP90:CDC37 [plasma membrane]', 'VCP:PolyUb-Misfolded Proteins:HDAC6:HSP90:HSF1 [cytosol]', 'ERBB2 T733I:ERBIN:HSP90:CDC37 [plasma membrane]', 'ERBB2 KD mutants (AEE788 resistant):ERBIN:HSP90:CDC37 [plasma membrane]', 'MLKL:HSP90:CDC37 [cytosol]', 'EGF:Ligand-responsive p-6Y-EGFR mutants sensitive to non-covalent TKIs:HSP90:CDC37 [plasma membrane]', 'ERBB2 KD mutants (trastuzumab sensitive):ERBIN:HSP90:CDC37 [plasma membrane]', 'HSP90:HSF1 [cytosol]', 'ERBB2 TMD/JMD mutants (trastuzumab):ERBIN:HSP90:CDC37 [plasma membrane]', 'ERBB2 R678Q:ERBIN:HSP90:CDC37 [plasma membrane]', 'p-5Y-EGFRvIII:PLCG1 [plasma membrane]', 'p-5Y-EGFRvIII:p-Y771,Y783,Y1254-PLCG1 [plasma membrane]', 'ERBB2 KD mutants (osimertinib resistant):ERBIN:HSP90:CDC37 [plasma membrane]', 'p-5Y-EGFRvIII:p-Y349,Y350-SHC1 [plasma membrane]', 'Ligand-responsive EGFR mutants resistant to non-covalent TKIs:HSP90:CDC37 [plasma membrane]', 'ERBB2 ECD mutants:ERBIN:HSP90:CDC37:TKIs [plasma membrane]', 'Ub-ERBB2:ERBIN:HSP90:CDC37 [plasma membrane]', 'Ligand-responsive p-6Y-EGFR mutants resistant to non-covalent TKIs:HSP90:CDC37 [plasma membrane]', 'Ligand-responsive EGFR mutants sensitive to non-covalent TKIs:HSP90:CDC37 [plasma membrane]', 'VCP:HDAC6:HSP90:HSF1 [cytosol]', 'Ub-ERBB2:ERBIN:Ub-HSP90:CDC37 [plasma membrane]', 'Dimers of EGF:Ligand-responsive EGFR mutants resistant to non-covalent TKIs [plasma membrane]', 'p-5Y-EGFRvIII:SHC1 [plasma membrane]', 'ERBB2:trastuzumab:ERBIN:HSP90:CDC37 [plasma membrane]', 'Dimers of EGF:Ligand-responsive EGFR mutants sensitive to non-covalent TKIs [plasma membrane]', 'Dimers of ligand-responsive EGFR mutants sensitive to non-covalent TKIs  [plasma membrane]', 'ERBB2 KD mutants (trastuzumab sensitive):trastuzumab:ERBIN:HSP90:CDC37 [plasma membrane]', 'ERBB2 TMD/JMD mutants:ERBIN:HSP90:CDC37 [plasma membrane]', 'ERBB2:ERBIN:HSP90:CDC37 [plasma membrane]', 'p-5Y-EGFRvIII:GRB2:GAB1:PI3K [plasma membrane]', 'ERBB2:pertuzumab:ERBIN:HSP90:CDC37 [plasma membrane]', 'ERBB2 T862A:ERBIN:HSP90:CDC37 [plasma membrane]', 'ERBB2 KD mutants:TKIs:ERBIN:HSP90:CDC37 [plasma membrane]', 'EGF:Ligand-responsive p-6Y-EGFR mutants resistant to non-covalent TKIs:HSP90:CDC37 [plasma membrane]', 'p-5Y-EGFRvIII mutant dimer [plasma membrane]', 'ERBB2 T798M:ERBIN:HSP90:CDC37 [plasma membrane]', 'HSP90 [cytosol]', 'Dimers of ligand-responsive EGFR mutants resistant to non-covalent TKIs [plasma membrane]', 'ERBB2:TKIs:ERBIN:HSP90:CDC37 [plasma membrane]', 'ERBB2 TMD/JMD mutants (TKI sensitive):ERBIN:HSP90:CDC37 [plasma membrane]', 'ERBB2 KD mutants (trastuzumab resistant):ERBIN:HSP90:CDC37 [plasma membrane]', 'Ligand-responsive p-6Y-EGFR mutants sensitive to non-covalent TKIs:HSP90:CDC37 [plasma membrane]', 'HSP90:Benzoquinoid ansamycins [cytosol]', 'ERBB2 TMD/JMD mutants (trastuzumab):trastuzumab:ERBIN:HSP90:CDC37 [plasma membrane]', 'EGFRvIII mutant:HSP90:CDC37 [plasma membrane]', 'ERBB2 KD mutants:ERBIN:HSP90:CDC37 [plasma membrane]', 'p-5Y-EGFRvIII:GRB2:GAB1 [plasma membrane]', 'p-5Y-EGFRvIII:GRB2:SOS1 [plasma membrane]', 'ERBB2 KD mutants (lapatinib resistant):ERBIN:HSP90:CDC37 [plasma membrane]']",0.0030599071261598137,0.0030587624701018685,1,0.021739130434782608,Disease,"['RNGTT', 'HSP90AA1', 'HMGB1']",0.17371599581369093,0.17377206265847317,3,0.06521739130434782,1.0,1.0,0.18883900450747373,0.18877807637557167,0.5750473443791513,0.575262539718045,0.04423441110608856,0.04425096459369577,STRIATUM_1 # s1,REACTOME
Apoptosis induced DNA fragmentation,['HMGB1'],"['DFF40 homodimer [nucleoplasm]', 'importin-alpha:importin-beta [cytosol]', 'DFF:associated with the importin-alpha:importin-beta complex [cytosol]', 'importin-alpha:importin-beta complex [nucleoplasm]', 'DFF:associated with the importin-alpha:importin-beta complex [nucleoplasm]', 'PPE2:KPNA1:KPNB1 [nucleoplasm]', 'Caspase-3 [cytosol]', 'HMGB1/HMGB2- bound chromatin [nucleoplasm]', 'PPE2:KPNA1:KPNB1 [cytosol]', 'DFF40 associated with chromatin [nucleoplasm]', 'DIABLO:XIAP:Caspase-3 [cytosol]', 'DFFA:DFFB [nucleoplasm]', 'Caspase cleaved DFFA (117) [nucleoplasm]', 'XIAP:Caspase-3 [cytosol]', 'active caspase-3 [nucleoplasm]', 'CASP3(29-175):CASP3(176-277) [nucleoplasm]', 'Histone H1 bound chromatin DNA [nucleoplasm]', 'DFF cleaved DNA [nucleoplasm]', 'DFFA:DFFB [cytosol]', 'CASP3(29-175):CASP3(176-277) [cytosol]', 'caspase-3-cleaved DFFA (117,224):DFFB complex [nucleoplasm]']",0.009911247397700286,0.00990755227301445,1,0.021739130434782608,Programmed Cell Death,"['HSP90AA1', 'HMGB1']",0.010568896789927054,0.010611343244081892,2,0.043478260869565216,1.0,1.0,0.023749196784373757,0.023654197577455786,1.0,1.0,0.04434809112682658,0.044364631208753655,STRIATUM_1 # s1,REACTOME
Regulation of CDH11 mRNA translation by microRNAs,['TNRC6A'],"['miR-451a Nonendonucleolytic Minimal RISC [cytosol]', 'miR-200c-3p Nonendonucleolytic RISC [cytosol]', 'miR-200c-3p Endonucleolytic Minimal RISC [cytosol]', 'miR-451a Nonendonucleolytic RISC [cytosol]', 'miR-451a Endonucleolytic Minimal RISC [cytosol]', 'miR-451a RISC:CDH11 mRNA [cytosol]', 'miR-200c-3p RISC:CDH11 mRNA [cytosol]', 'miR-451a Endonucleolytic RISC [cytosol]', 'miR-200c-3p Endonucleolytic RISC [cytosol]', 'miR-200c-3p Nonendonucleolytic Minimal RISC [cytosol]']",0.008392719246858298,0.008389587912680763,1,0.021739130434782608,Cell-Cell communication,['TNRC6A'],0.1134688400969454,0.11342878505465329,1,0.021739130434782608,1.0,1.0,0.14122259331307827,0.14127246316705785,1.0,1.0,0.04506407221668524,0.04508089195455314,STRIATUM_1 # s1,REACTOME
eNOS activation,['HSP90AA1'],"['CALM1:Ca2+:CNG channel [plasma membrane]', 'Gly,D-Ser:L-Glu:GRIN1:GRIN2B NMDA receptors:p-T286-CaMKII dodecamer:CALM1:4xCa2+ [plasma membrane]', 'p-T177-CAMK1:CALM1:4xCa2+ [cytosol]', 'p-T287-CAMK2G dodecamer:CALM1:4xCa2+ [cytosol]', 'S-Farn-Me KRAS4B:CALM1:4xCa2+:PDE6D [cytosol]', 'eNOS:Caveolin-1:NOSTRIN:Dynamin-2 [plasma membrane]', 'ADCY1,ADCY8:CALM1:4xCa2+ [plasma membrane]', 'p-S1177-eNOS dimer [plasma membrane]', 'S-Farn-Me KRAS4B:CALM1:4xCa2+:PDE6D:ARL2:GTP [cytosol]', 'myristoylated eNOS dimer [cytosol]', 'PPP3CA,B:Calmodulin [cytosol]', 'Gly,D-Ser:L-Glu:GRIN1:GRIN2 NMDA receptors:CALM1:4xCa2+ [plasma membrane]', 'CYGB:ferroheme [cytosol]', 'CYBG(Fe3+) dimer [cytosol]', 'p-S1177-eNOS:CaM:HSP90:p-AKT1 [plasma membrane]', 'NFAT:CaN:CaM [cytosol]', 'CAMK1:CALM1:4xCa2+ [cytosol]', 'S-Farn-Me KRAS4B:CALM1:4xCa2+ [plasma membrane]', 'Rasgrf1 oligomer:CALM1:4xCa2+ [plasma membrane]', 'eNOS:CaM:HSP90 [plasma membrane]', 'eNOS:CaM:HSP90:p-AKT1 [plasma membrane]', 'eNOS:NOSIP [plasma membrane]', 'eNOS:Caveolin-1:NOSTRIN:dynamin-2:N-WASP [plasma membrane]', 'TRPV4 tetramer:CALM1:Ca2+ [plasma membrane]', 'LYPLA1 dimer [cytosol]', 'CaMKII dodecamer:CALM1:4xCa2+ [cytosol]', 'p-S1177-eNOS:CaM:HSP90:p-AKT1:BH2 [plasma membrane]', 'palmitoylated, myristoylated eNOS dimer [plasma membrane]', 'CALM1:4Ca2+ [plasma membrane]', 'p-T287-CAMK2B dodecamer:CALM1:4xCa2+ [cytosol]', 'myristoylated eNOS dimer [Golgi membrane]', 'p-T286-CaMKII dodecamer:CALM1:4xCa2+ [cytosol]', 'S-Farn-Me KRAS4B:CALM1:4xCa2+ [cytosol]', 'CYGB:ferriheme [cytosol]', 'PPP3 complex [cytosol]', 'p-SPR dimer [cytosol]', 'CYGB(Fe2+) dimer [cytosol]', 'Gly,D-Ser:L-Glu:GRIN1:GRIN2B NMDA receptor:RASGRF1 oligomer:CALM1:4xCa2+ [plasma membrane]', 'eNOS:Caveolin-1:CaM:HSP90 [plasma membrane]', 'MYLK:Ca2+:CALM1 [cytosol]', 'CAMKK1:CALM1:4xCa2+ [cytosol]', 'GRK2:CALM1:4xCa2+ [plasma membrane]', 'CAMK2 heteromer:CALM:4xCa2+ [plasma membrane]', 'CAMK2:CaM [cytosol]', 'NFATC1:CaN:CaM [cytosol]', 'p-CaMKK:CALM1:4xCa2+ [cytosol]', 'p-CAMKK2:CALM1:4xCa2+ [cytosol]', 'RAC1:GTP,CDC42:GTP:IQGAPs:CALM1:4Ca2+ [plasma membrane]', 'p-T286 CAMK2:CaM [cytosol]', 'PPP3CA,B,C:Fe3+:Zn2+:4xCa2+:CaM [cytosol]', 'CYGB dimer:O2 [cytosol]', 'Calcineurin:Calmodulin (CaN:CaM) [cytosol]', 'Calcineurin:p-NFATC1,2,3 [cytosol]', 'eNOS:Caveolin-1 [plasma membrane]', 'Camkk1:CALM1:4xCa2+ [cytosol]', 'p-S1177-eNOS:CaM:HSP90:p-AKT1:BH4 [plasma membrane]', 'eNOS:Caveolin-1:CaM [plasma membrane]', 'CALM1:4xCa2+ [cytosol]', 'CaMKK:CALM1:4xCa2+ [cytosol]', 'eNOS:Caveolin-1:NOSTRIN complex [plasma membrane]']",0.009911247397700286,0.00990755227301445,1,0.021739130434782608,Metabolism,"['HSP90AA1', 'TTC19', 'SAMD8', 'ALDH6A1']",0.07745945420343218,0.07753393856374723,4,0.08695652173913043,1.0,1.0,0.1095968454886051,0.10949155932515227,1.0,1.0,0.04542975188601747,0.04544669538457692,STRIATUM_1 # s1,REACTOME
